<?xml version="1.0" encoding="UTF-8"?>
<!--Sample XML file generated by XMLSPY v5 U (http://www.xmlspy.com)-->
<document xmlns:xsi="http://www.w3.org/2001/XMLSchema-instance" xsi:noNamespaceSchemaLocation="E:\java\eclipse-3.0M3\eclipse\workspace\schema\test\test.xsd">
	<person gender="male">
		<name>Huga Balder</name>
		<street>LolaStreet 12a</street>
		<city country="D">23734 Flensburg</city>
	</person>
	<person gender="male">
		<name>Huga Balder</name>
		<street>LolaStreet 12a</street>
		<city country="D">23734 Flensburg</city>
	</person>
</document>
